entry_id,updated,published,title,authors,summary,comment,journal_ref,doi,primary_category,categories,links,pdf_url,_raw
http://arxiv.org/abs/2202.13587v3,2022-04-03 23:32:50+00:00,2022-02-28 07:36:30+00:00,Rethinking and Refining the Distinct Metric,"[arxiv.Result.Author('Siyang Liu'), arxiv.Result.Author('Sahand Sabour'), arxiv.Result.Author('Yinhe Zheng'), arxiv.Result.Author('Pei Ke'), arxiv.Result.Author('Xiaoyan Zhu'), arxiv.Result.Author('Minlie Huang')]","Distinct-$n$ score\cite{Li2016} is a widely used automatic metric for
evaluating diversity in language generation tasks. However, we observed that
the original approach for calculating distinct scores has evident biases that
tend to assign higher penalties to longer sequences. We refine the calculation
of distinct scores by scaling the number of distinct tokens based on their
expectations. We provide both empirical and theoretical evidence to show that
our method effectively removes the biases existing in the original distinct
score. Our experiments show that our proposed metric,
\textit{Expectation-Adjusted Distinct (EAD)}, correlates better with human
judgment in evaluating response diversity. To foster future research, we
provide an example implementation at
\url{https://github.com/lsy641/Expectation-Adjusted-Distinct}.","4 pages, to be published at ACL2022",,,cs.CL,"['cs.CL', 'cs.AI', 'I.2.7']","[arxiv.Result.Link('http://arxiv.org/abs/2202.13587v3', title=None, rel='alternate', content_type=None), arxiv.Result.Link('http://arxiv.org/pdf/2202.13587v3', title='pdf', rel='related', content_type=None)]",http://arxiv.org/pdf/2202.13587v3,"{'id': 'http://arxiv.org/abs/2202.13587v3', 'guidislink': True, 'link': 'http://arxiv.org/abs/2202.13587v3', 'updated': '2022-04-03T23:32:50Z', 'updated_parsed': time.struct_time(tm_year=2022, tm_mon=4, tm_mday=3, tm_hour=23, tm_min=32, tm_sec=50, tm_wday=6, tm_yday=93, tm_isdst=0), 'published': '2022-02-28T07:36:30Z', 'published_parsed': time.struct_time(tm_year=2022, tm_mon=2, tm_mday=28, tm_hour=7, tm_min=36, tm_sec=30, tm_wday=0, tm_yday=59, tm_isdst=0), 'title': 'Rethinking and Refining the Distinct Metric', 'title_detail': {'type': 'text/plain', 'language': None, 'base': '', 'value': 'Rethinking and Refining the Distinct Metric'}, 'summary': 'Distinct-$n$ score\\cite{Li2016} is a widely used automatic metric for\nevaluating diversity in language generation tasks. However, we observed that\nthe original approach for calculating distinct scores has evident biases that\ntend to assign higher penalties to longer sequences. We refine the calculation\nof distinct scores by scaling the number of distinct tokens based on their\nexpectations. We provide both empirical and theoretical evidence to show that\nour method effectively removes the biases existing in the original distinct\nscore. Our experiments show that our proposed metric,\n\\textit{Expectation-Adjusted Distinct (EAD)}, correlates better with human\njudgment in evaluating response diversity. To foster future research, we\nprovide an example implementation at\n\\url{https://github.com/lsy641/Expectation-Adjusted-Distinct}.', 'summary_detail': {'type': 'text/plain', 'language': None, 'base': '', 'value': 'Distinct-$n$ score\\cite{Li2016} is a widely used automatic metric for\nevaluating diversity in language generation tasks. However, we observed that\nthe original approach for calculating distinct scores has evident biases that\ntend to assign higher penalties to longer sequences. We refine the calculation\nof distinct scores by scaling the number of distinct tokens based on their\nexpectations. We provide both empirical and theoretical evidence to show that\nour method effectively removes the biases existing in the original distinct\nscore. Our experiments show that our proposed metric,\n\\textit{Expectation-Adjusted Distinct (EAD)}, correlates better with human\njudgment in evaluating response diversity. To foster future research, we\nprovide an example implementation at\n\\url{https://github.com/lsy641/Expectation-Adjusted-Distinct}.'}, 'authors': [{'name': 'Siyang Liu'}, {'name': 'Sahand Sabour'}, {'name': 'Yinhe Zheng'}, {'name': 'Pei Ke'}, {'name': 'Xiaoyan Zhu'}, {'name': 'Minlie Huang'}], 'author_detail': {'name': 'Minlie Huang'}, 'author': 'Minlie Huang', 'arxiv_comment': '4 pages, to be published at ACL2022', 'links': [{'href': 'http://arxiv.org/abs/2202.13587v3', 'rel': 'alternate', 'type': 'text/html'}, {'title': 'pdf', 'href': 'http://arxiv.org/pdf/2202.13587v3', 'rel': 'related', 'type': 'application/pdf'}], 'arxiv_primary_category': {'term': 'cs.CL', 'scheme': 'http://arxiv.org/schemas/atom'}, 'tags': [{'term': 'cs.CL', 'scheme': 'http://arxiv.org/schemas/atom', 'label': None}, {'term': 'cs.AI', 'scheme': 'http://arxiv.org/schemas/atom', 'label': None}, {'term': 'I.2.7', 'scheme': 'http://arxiv.org/schemas/atom', 'label': None}]}"
http://arxiv.org/abs/2203.00056v1,2022-02-28 19:50:23+00:00,2022-02-28 19:50:23+00:00,An Empirical Study on Explanations in Out-of-Domain Settings,"[arxiv.Result.Author('George Chrysostomou'), arxiv.Result.Author('Nikolaos Aletras')]","Recent work in Natural Language Processing has focused on developing
approaches that extract faithful explanations, either via identifying the most
important tokens in the input (i.e. post-hoc explanations) or by designing
inherently faithful models that first select the most important tokens and then
use them to predict the correct label (i.e. select-then-predict models).
Currently, these approaches are largely evaluated on in-domain settings. Yet,
little is known about how post-hoc explanations and inherently faithful models
perform in out-of-domain settings. In this paper, we conduct an extensive
empirical study that examines: (1) the out-of-domain faithfulness of post-hoc
explanations, generated by five feature attribution methods; and (2) the
out-of-domain performance of two inherently faithful models over six datasets.
Contrary to our expectations, results show that in many cases out-of-domain
post-hoc explanation faithfulness measured by sufficiency and comprehensiveness
is higher compared to in-domain. We find this misleading and suggest using a
random baseline as a yardstick for evaluating post-hoc explanation
faithfulness. Our findings also show that select-then predict models
demonstrate comparable predictive performance in out-of-domain settings to
full-text trained models.",ACL2022 Pre-print,,,cs.CL,['cs.CL'],"[arxiv.Result.Link('http://arxiv.org/abs/2203.00056v1', title=None, rel='alternate', content_type=None), arxiv.Result.Link('http://arxiv.org/pdf/2203.00056v1', title='pdf', rel='related', content_type=None)]",http://arxiv.org/pdf/2203.00056v1,"{'id': 'http://arxiv.org/abs/2203.00056v1', 'guidislink': True, 'link': 'http://arxiv.org/abs/2203.00056v1', 'updated': '2022-02-28T19:50:23Z', 'updated_parsed': time.struct_time(tm_year=2022, tm_mon=2, tm_mday=28, tm_hour=19, tm_min=50, tm_sec=23, tm_wday=0, tm_yday=59, tm_isdst=0), 'published': '2022-02-28T19:50:23Z', 'published_parsed': time.struct_time(tm_year=2022, tm_mon=2, tm_mday=28, tm_hour=19, tm_min=50, tm_sec=23, tm_wday=0, tm_yday=59, tm_isdst=0), 'title': 'An Empirical Study on Explanations in Out-of-Domain Settings', 'title_detail': {'type': 'text/plain', 'language': None, 'base': '', 'value': 'An Empirical Study on Explanations in Out-of-Domain Settings'}, 'summary': 'Recent work in Natural Language Processing has focused on developing\napproaches that extract faithful explanations, either via identifying the most\nimportant tokens in the input (i.e. post-hoc explanations) or by designing\ninherently faithful models that first select the most important tokens and then\nuse them to predict the correct label (i.e. select-then-predict models).\nCurrently, these approaches are largely evaluated on in-domain settings. Yet,\nlittle is known about how post-hoc explanations and inherently faithful models\nperform in out-of-domain settings. In this paper, we conduct an extensive\nempirical study that examines: (1) the out-of-domain faithfulness of post-hoc\nexplanations, generated by five feature attribution methods; and (2) the\nout-of-domain performance of two inherently faithful models over six datasets.\nContrary to our expectations, results show that in many cases out-of-domain\npost-hoc explanation faithfulness measured by sufficiency and comprehensiveness\nis higher compared to in-domain. We find this misleading and suggest using a\nrandom baseline as a yardstick for evaluating post-hoc explanation\nfaithfulness. Our findings also show that select-then predict models\ndemonstrate comparable predictive performance in out-of-domain settings to\nfull-text trained models.', 'summary_detail': {'type': 'text/plain', 'language': None, 'base': '', 'value': 'Recent work in Natural Language Processing has focused on developing\napproaches that extract faithful explanations, either via identifying the most\nimportant tokens in the input (i.e. post-hoc explanations) or by designing\ninherently faithful models that first select the most important tokens and then\nuse them to predict the correct label (i.e. select-then-predict models).\nCurrently, these approaches are largely evaluated on in-domain settings. Yet,\nlittle is known about how post-hoc explanations and inherently faithful models\nperform in out-of-domain settings. In this paper, we conduct an extensive\nempirical study that examines: (1) the out-of-domain faithfulness of post-hoc\nexplanations, generated by five feature attribution methods; and (2) the\nout-of-domain performance of two inherently faithful models over six datasets.\nContrary to our expectations, results show that in many cases out-of-domain\npost-hoc explanation faithfulness measured by sufficiency and comprehensiveness\nis higher compared to in-domain. We find this misleading and suggest using a\nrandom baseline as a yardstick for evaluating post-hoc explanation\nfaithfulness. Our findings also show that select-then predict models\ndemonstrate comparable predictive performance in out-of-domain settings to\nfull-text trained models.'}, 'authors': [{'name': 'George Chrysostomou'}, {'name': 'Nikolaos Aletras'}], 'author_detail': {'name': 'Nikolaos Aletras'}, 'author': 'Nikolaos Aletras', 'arxiv_comment': 'ACL2022 Pre-print', 'links': [{'href': 'http://arxiv.org/abs/2203.00056v1', 'rel': 'alternate', 'type': 'text/html'}, {'title': 'pdf', 'href': 'http://arxiv.org/pdf/2203.00056v1', 'rel': 'related', 'type': 'application/pdf'}], 'arxiv_primary_category': {'term': 'cs.CL', 'scheme': 'http://arxiv.org/schemas/atom'}, 'tags': [{'term': 'cs.CL', 'scheme': 'http://arxiv.org/schemas/atom', 'label': None}]}"
http://arxiv.org/abs/2203.03802v2,2022-03-16 02:19:10+00:00,2022-03-08 01:47:42+00:00,Understanding Iterative Revision from Human-Written Text,"[arxiv.Result.Author('Wanyu Du'), arxiv.Result.Author('Vipul Raheja'), arxiv.Result.Author('Dhruv Kumar'), arxiv.Result.Author('Zae Myung Kim'), arxiv.Result.Author('Melissa Lopez'), arxiv.Result.Author('Dongyeop Kang')]","Writing is, by nature, a strategic, adaptive, and more importantly, an
iterative process. A crucial part of writing is editing and revising the text.
Previous works on text revision have focused on defining edit intention
taxonomies within a single domain or developing computational models with a
single level of edit granularity, such as sentence-level edits, which differ
from human's revision cycles. This work describes IteraTeR: the first
large-scale, multi-domain, edit-intention annotated corpus of iteratively
revised text. In particular, IteraTeR is collected based on a new framework to
comprehensively model the iterative text revisions that generalize to various
domains of formal writing, edit intentions, revision depths, and granularities.
When we incorporate our annotated edit intentions, both generative and
edit-based text revision models significantly improve automatic evaluations.
Through our work, we better understand the text revision process, making vital
connections between edit intentions and writing quality, enabling the creation
of diverse corpora to support computational modeling of iterative text
revisions.",To appear in ACL2022,,10.18653/v1/2022.acl-long.250,cs.CL,"['cs.CL', 'cs.HC']","[arxiv.Result.Link('http://dx.doi.org/10.18653/v1/2022.acl-long.250', title='doi', rel='related', content_type=None), arxiv.Result.Link('http://arxiv.org/abs/2203.03802v2', title=None, rel='alternate', content_type=None), arxiv.Result.Link('http://arxiv.org/pdf/2203.03802v2', title='pdf', rel='related', content_type=None)]",http://arxiv.org/pdf/2203.03802v2,"{'id': 'http://arxiv.org/abs/2203.03802v2', 'guidislink': True, 'link': 'http://arxiv.org/abs/2203.03802v2', 'updated': '2022-03-16T02:19:10Z', 'updated_parsed': time.struct_time(tm_year=2022, tm_mon=3, tm_mday=16, tm_hour=2, tm_min=19, tm_sec=10, tm_wday=2, tm_yday=75, tm_isdst=0), 'published': '2022-03-08T01:47:42Z', 'published_parsed': time.struct_time(tm_year=2022, tm_mon=3, tm_mday=8, tm_hour=1, tm_min=47, tm_sec=42, tm_wday=1, tm_yday=67, tm_isdst=0), 'title': 'Understanding Iterative Revision from Human-Written Text', 'title_detail': {'type': 'text/plain', 'language': None, 'base': '', 'value': 'Understanding Iterative Revision from Human-Written Text'}, 'summary': ""Writing is, by nature, a strategic, adaptive, and more importantly, an\niterative process. A crucial part of writing is editing and revising the text.\nPrevious works on text revision have focused on defining edit intention\ntaxonomies within a single domain or developing computational models with a\nsingle level of edit granularity, such as sentence-level edits, which differ\nfrom human's revision cycles. This work describes IteraTeR: the first\nlarge-scale, multi-domain, edit-intention annotated corpus of iteratively\nrevised text. In particular, IteraTeR is collected based on a new framework to\ncomprehensively model the iterative text revisions that generalize to various\ndomains of formal writing, edit intentions, revision depths, and granularities.\nWhen we incorporate our annotated edit intentions, both generative and\nedit-based text revision models significantly improve automatic evaluations.\nThrough our work, we better understand the text revision process, making vital\nconnections between edit intentions and writing quality, enabling the creation\nof diverse corpora to support computational modeling of iterative text\nrevisions."", 'summary_detail': {'type': 'text/plain', 'language': None, 'base': '', 'value': ""Writing is, by nature, a strategic, adaptive, and more importantly, an\niterative process. A crucial part of writing is editing and revising the text.\nPrevious works on text revision have focused on defining edit intention\ntaxonomies within a single domain or developing computational models with a\nsingle level of edit granularity, such as sentence-level edits, which differ\nfrom human's revision cycles. This work describes IteraTeR: the first\nlarge-scale, multi-domain, edit-intention annotated corpus of iteratively\nrevised text. In particular, IteraTeR is collected based on a new framework to\ncomprehensively model the iterative text revisions that generalize to various\ndomains of formal writing, edit intentions, revision depths, and granularities.\nWhen we incorporate our annotated edit intentions, both generative and\nedit-based text revision models significantly improve automatic evaluations.\nThrough our work, we better understand the text revision process, making vital\nconnections between edit intentions and writing quality, enabling the creation\nof diverse corpora to support computational modeling of iterative text\nrevisions.""}, 'authors': [{'name': 'Wanyu Du'}, {'name': 'Vipul Raheja'}, {'name': 'Dhruv Kumar'}, {'name': 'Zae Myung Kim'}, {'name': 'Melissa Lopez'}, {'name': 'Dongyeop Kang'}], 'author_detail': {'name': 'Dongyeop Kang'}, 'author': 'Dongyeop Kang', 'arxiv_doi': '10.18653/v1/2022.acl-long.250', 'links': [{'title': 'doi', 'href': 'http://dx.doi.org/10.18653/v1/2022.acl-long.250', 'rel': 'related', 'type': 'text/html'}, {'href': 'http://arxiv.org/abs/2203.03802v2', 'rel': 'alternate', 'type': 'text/html'}, {'title': 'pdf', 'href': 'http://arxiv.org/pdf/2203.03802v2', 'rel': 'related', 'type': 'application/pdf'}], 'arxiv_comment': 'To appear in ACL2022', 'arxiv_primary_category': {'term': 'cs.CL', 'scheme': 'http://arxiv.org/schemas/atom'}, 'tags': [{'term': 'cs.CL', 'scheme': 'http://arxiv.org/schemas/atom', 'label': None}, {'term': 'cs.HC', 'scheme': 'http://arxiv.org/schemas/atom', 'label': None}]}"
http://arxiv.org/abs/2203.07216v2,2022-10-27 21:29:36+00:00,2022-03-14 15:55:21+00:00,A Novel Perspective to Look At Attention: Bi-level Attention-based Explainable Topic Modeling for News Classification,"[arxiv.Result.Author('Dairui Liu'), arxiv.Result.Author('Derek Greene'), arxiv.Result.Author('Ruihai Dong')]","Many recent deep learning-based solutions have widely adopted the
attention-based mechanism in various tasks of the NLP discipline. However, the
inherent characteristics of deep learning models and the flexibility of the
attention mechanism increase the models' complexity, thus leading to challenges
in model explainability. In this paper, to address this challenge, we propose a
novel practical framework by utilizing a two-tier attention architecture to
decouple the complexity of explanation and the decision-making process. We
apply it in the context of a news article classification task. The experiments
on two large-scaled news corpora demonstrate that the proposed model can
achieve competitive performance with many state-of-the-art alternatives and
illustrate its appropriateness from an explainability perspective.",Findings of ACL2022,,10.18653/v1/2022.findings-acl.178,cs.CL,['cs.CL'],"[arxiv.Result.Link('http://dx.doi.org/10.18653/v1/2022.findings-acl.178', title='doi', rel='related', content_type=None), arxiv.Result.Link('http://arxiv.org/abs/2203.07216v2', title=None, rel='alternate', content_type=None), arxiv.Result.Link('http://arxiv.org/pdf/2203.07216v2', title='pdf', rel='related', content_type=None)]",http://arxiv.org/pdf/2203.07216v2,"{'id': 'http://arxiv.org/abs/2203.07216v2', 'guidislink': True, 'link': 'http://arxiv.org/abs/2203.07216v2', 'updated': '2022-10-27T21:29:36Z', 'updated_parsed': time.struct_time(tm_year=2022, tm_mon=10, tm_mday=27, tm_hour=21, tm_min=29, tm_sec=36, tm_wday=3, tm_yday=300, tm_isdst=0), 'published': '2022-03-14T15:55:21Z', 'published_parsed': time.struct_time(tm_year=2022, tm_mon=3, tm_mday=14, tm_hour=15, tm_min=55, tm_sec=21, tm_wday=0, tm_yday=73, tm_isdst=0), 'title': 'A Novel Perspective to Look At Attention: Bi-level Attention-based\n  Explainable Topic Modeling for News Classification', 'title_detail': {'type': 'text/plain', 'language': None, 'base': '', 'value': 'A Novel Perspective to Look At Attention: Bi-level Attention-based\n  Explainable Topic Modeling for News Classification'}, 'summary': ""Many recent deep learning-based solutions have widely adopted the\nattention-based mechanism in various tasks of the NLP discipline. However, the\ninherent characteristics of deep learning models and the flexibility of the\nattention mechanism increase the models' complexity, thus leading to challenges\nin model explainability. In this paper, to address this challenge, we propose a\nnovel practical framework by utilizing a two-tier attention architecture to\ndecouple the complexity of explanation and the decision-making process. We\napply it in the context of a news article classification task. The experiments\non two large-scaled news corpora demonstrate that the proposed model can\nachieve competitive performance with many state-of-the-art alternatives and\nillustrate its appropriateness from an explainability perspective."", 'summary_detail': {'type': 'text/plain', 'language': None, 'base': '', 'value': ""Many recent deep learning-based solutions have widely adopted the\nattention-based mechanism in various tasks of the NLP discipline. However, the\ninherent characteristics of deep learning models and the flexibility of the\nattention mechanism increase the models' complexity, thus leading to challenges\nin model explainability. In this paper, to address this challenge, we propose a\nnovel practical framework by utilizing a two-tier attention architecture to\ndecouple the complexity of explanation and the decision-making process. We\napply it in the context of a news article classification task. The experiments\non two large-scaled news corpora demonstrate that the proposed model can\nachieve competitive performance with many state-of-the-art alternatives and\nillustrate its appropriateness from an explainability perspective.""}, 'authors': [{'name': 'Dairui Liu'}, {'name': 'Derek Greene'}, {'name': 'Ruihai Dong'}], 'author_detail': {'name': 'Ruihai Dong'}, 'author': 'Ruihai Dong', 'arxiv_doi': '10.18653/v1/2022.findings-acl.178', 'links': [{'title': 'doi', 'href': 'http://dx.doi.org/10.18653/v1/2022.findings-acl.178', 'rel': 'related', 'type': 'text/html'}, {'href': 'http://arxiv.org/abs/2203.07216v2', 'rel': 'alternate', 'type': 'text/html'}, {'title': 'pdf', 'href': 'http://arxiv.org/pdf/2203.07216v2', 'rel': 'related', 'type': 'application/pdf'}], 'arxiv_comment': 'Findings of ACL2022', 'arxiv_primary_category': {'term': 'cs.CL', 'scheme': 'http://arxiv.org/schemas/atom'}, 'tags': [{'term': 'cs.CL', 'scheme': 'http://arxiv.org/schemas/atom', 'label': None}]}"
