entry_id,updated,published,title,authors,summary,comment,journal_ref,doi,primary_category,categories,links,pdf_url,_raw
http://arxiv.org/abs/2109.04332v3,2022-03-14 02:05:06+00:00,2021-09-09 15:11:04+00:00,PPT: Pre-trained Prompt Tuning for Few-shot Learning,"[arxiv.Result.Author('Yuxian Gu'), arxiv.Result.Author('Xu Han'), arxiv.Result.Author('Zhiyuan Liu'), arxiv.Result.Author('Minlie Huang')]","Prompts for pre-trained language models (PLMs) have shown remarkable
performance by bridging the gap between pre-training tasks and various
downstream tasks. Among these methods, prompt tuning, which freezes PLMs and
only tunes soft prompts, provides an efficient and effective solution for
adapting large-scale PLMs to downstream tasks. However, prompt tuning is yet to
be fully explored. In our pilot experiments, we find that prompt tuning
performs comparably with conventional full-model fine-tuning when downstream
data are sufficient, whereas it performs much worse under few-shot learning
settings, which may hinder the application of prompt tuning in practice. We
attribute this low performance to the manner of initializing soft prompts.
Therefore, in this work, we propose to pre-train prompts by adding soft prompts
into the pre-training stage to obtain a better initialization. We name this
Pre-trained Prompt Tuning framework ""PPT"". To ensure the generalization of PPT,
we formulate similar classification tasks into a unified task form and
pre-train soft prompts for this unified task. Extensive experiments show that
tuning pre-trained prompts for downstream tasks can reach or even outperform
full-model fine-tuning under both full-data and few-shot settings. Our approach
is effective and efficient for using large-scale PLMs in practice.",Accepted by ACL2022 (main conference),,,cs.CL,['cs.CL'],"[arxiv.Result.Link('http://arxiv.org/abs/2109.04332v3', title=None, rel='alternate', content_type=None), arxiv.Result.Link('http://arxiv.org/pdf/2109.04332v3', title='pdf', rel='related', content_type=None)]",http://arxiv.org/pdf/2109.04332v3,"{'id': 'http://arxiv.org/abs/2109.04332v3', 'guidislink': True, 'link': 'http://arxiv.org/abs/2109.04332v3', 'updated': '2022-03-14T02:05:06Z', 'updated_parsed': time.struct_time(tm_year=2022, tm_mon=3, tm_mday=14, tm_hour=2, tm_min=5, tm_sec=6, tm_wday=0, tm_yday=73, tm_isdst=0), 'published': '2021-09-09T15:11:04Z', 'published_parsed': time.struct_time(tm_year=2021, tm_mon=9, tm_mday=9, tm_hour=15, tm_min=11, tm_sec=4, tm_wday=3, tm_yday=252, tm_isdst=0), 'title': 'PPT: Pre-trained Prompt Tuning for Few-shot Learning', 'title_detail': {'type': 'text/plain', 'language': None, 'base': '', 'value': 'PPT: Pre-trained Prompt Tuning for Few-shot Learning'}, 'summary': 'Prompts for pre-trained language models (PLMs) have shown remarkable\nperformance by bridging the gap between pre-training tasks and various\ndownstream tasks. Among these methods, prompt tuning, which freezes PLMs and\nonly tunes soft prompts, provides an efficient and effective solution for\nadapting large-scale PLMs to downstream tasks. However, prompt tuning is yet to\nbe fully explored. In our pilot experiments, we find that prompt tuning\nperforms comparably with conventional full-model fine-tuning when downstream\ndata are sufficient, whereas it performs much worse under few-shot learning\nsettings, which may hinder the application of prompt tuning in practice. We\nattribute this low performance to the manner of initializing soft prompts.\nTherefore, in this work, we propose to pre-train prompts by adding soft prompts\ninto the pre-training stage to obtain a better initialization. We name this\nPre-trained Prompt Tuning framework ""PPT"". To ensure the generalization of PPT,\nwe formulate similar classification tasks into a unified task form and\npre-train soft prompts for this unified task. Extensive experiments show that\ntuning pre-trained prompts for downstream tasks can reach or even outperform\nfull-model fine-tuning under both full-data and few-shot settings. Our approach\nis effective and efficient for using large-scale PLMs in practice.', 'summary_detail': {'type': 'text/plain', 'language': None, 'base': '', 'value': 'Prompts for pre-trained language models (PLMs) have shown remarkable\nperformance by bridging the gap between pre-training tasks and various\ndownstream tasks. Among these methods, prompt tuning, which freezes PLMs and\nonly tunes soft prompts, provides an efficient and effective solution for\nadapting large-scale PLMs to downstream tasks. However, prompt tuning is yet to\nbe fully explored. In our pilot experiments, we find that prompt tuning\nperforms comparably with conventional full-model fine-tuning when downstream\ndata are sufficient, whereas it performs much worse under few-shot learning\nsettings, which may hinder the application of prompt tuning in practice. We\nattribute this low performance to the manner of initializing soft prompts.\nTherefore, in this work, we propose to pre-train prompts by adding soft prompts\ninto the pre-training stage to obtain a better initialization. We name this\nPre-trained Prompt Tuning framework ""PPT"". To ensure the generalization of PPT,\nwe formulate similar classification tasks into a unified task form and\npre-train soft prompts for this unified task. Extensive experiments show that\ntuning pre-trained prompts for downstream tasks can reach or even outperform\nfull-model fine-tuning under both full-data and few-shot settings. Our approach\nis effective and efficient for using large-scale PLMs in practice.'}, 'authors': [{'name': 'Yuxian Gu'}, {'name': 'Xu Han'}, {'name': 'Zhiyuan Liu'}, {'name': 'Minlie Huang'}], 'author_detail': {'name': 'Minlie Huang'}, 'author': 'Minlie Huang', 'arxiv_comment': 'Accepted by ACL2022 (main conference)', 'links': [{'href': 'http://arxiv.org/abs/2109.04332v3', 'rel': 'alternate', 'type': 'text/html'}, {'title': 'pdf', 'href': 'http://arxiv.org/pdf/2109.04332v3', 'rel': 'related', 'type': 'application/pdf'}], 'arxiv_primary_category': {'term': 'cs.CL', 'scheme': 'http://arxiv.org/schemas/atom'}, 'tags': [{'term': 'cs.CL', 'scheme': 'http://arxiv.org/schemas/atom', 'label': None}]}"
http://arxiv.org/abs/2109.10341v2,2022-05-17 17:39:22+00:00,2021-09-21 17:49:34+00:00,Multilingual Document-Level Translation Enables Zero-Shot Transfer From Sentences to Documents,"[arxiv.Result.Author('Biao Zhang'), arxiv.Result.Author('Ankur Bapna'), arxiv.Result.Author('Melvin Johnson'), arxiv.Result.Author('Ali Dabirmoghaddam'), arxiv.Result.Author('Naveen Arivazhagan'), arxiv.Result.Author('Orhan Firat')]","Document-level neural machine translation (DocNMT) achieves coherent
translations by incorporating cross-sentence context. However, for most
language pairs there's a shortage of parallel documents, although parallel
sentences are readily available. In this paper, we study whether and how
contextual modeling in DocNMT is transferable via multilingual modeling. We
focus on the scenario of zero-shot transfer from teacher languages with
document level data to student languages with no documents but sentence level
data, and for the first time treat document-level translation as a transfer
learning problem. Using simple concatenation-based DocNMT, we explore the
effect of 3 factors on the transfer: the number of teacher languages with
document level data, the balance between document and sentence level data at
training, and the data condition of parallel documents (genuine vs.
backtranslated). Our experiments on Europarl-7 and IWSLT-10 show the
feasibility of multilingual transfer for DocNMT, particularly on
document-specific metrics. We observe that more teacher languages and adequate
data balance both contribute to better transfer quality. Surprisingly, the
transfer is less sensitive to the data condition, where multilingual DocNMT
delivers decent performance with either backtranslated or genuine document
pairs.",ACL2022,,,cs.CL,"['cs.CL', 'cs.LG']","[arxiv.Result.Link('http://arxiv.org/abs/2109.10341v2', title=None, rel='alternate', content_type=None), arxiv.Result.Link('http://arxiv.org/pdf/2109.10341v2', title='pdf', rel='related', content_type=None)]",http://arxiv.org/pdf/2109.10341v2,"{'id': 'http://arxiv.org/abs/2109.10341v2', 'guidislink': True, 'link': 'http://arxiv.org/abs/2109.10341v2', 'updated': '2022-05-17T17:39:22Z', 'updated_parsed': time.struct_time(tm_year=2022, tm_mon=5, tm_mday=17, tm_hour=17, tm_min=39, tm_sec=22, tm_wday=1, tm_yday=137, tm_isdst=0), 'published': '2021-09-21T17:49:34Z', 'published_parsed': time.struct_time(tm_year=2021, tm_mon=9, tm_mday=21, tm_hour=17, tm_min=49, tm_sec=34, tm_wday=1, tm_yday=264, tm_isdst=0), 'title': 'Multilingual Document-Level Translation Enables Zero-Shot Transfer From\n  Sentences to Documents', 'title_detail': {'type': 'text/plain', 'language': None, 'base': '', 'value': 'Multilingual Document-Level Translation Enables Zero-Shot Transfer From\n  Sentences to Documents'}, 'summary': ""Document-level neural machine translation (DocNMT) achieves coherent\ntranslations by incorporating cross-sentence context. However, for most\nlanguage pairs there's a shortage of parallel documents, although parallel\nsentences are readily available. In this paper, we study whether and how\ncontextual modeling in DocNMT is transferable via multilingual modeling. We\nfocus on the scenario of zero-shot transfer from teacher languages with\ndocument level data to student languages with no documents but sentence level\ndata, and for the first time treat document-level translation as a transfer\nlearning problem. Using simple concatenation-based DocNMT, we explore the\neffect of 3 factors on the transfer: the number of teacher languages with\ndocument level data, the balance between document and sentence level data at\ntraining, and the data condition of parallel documents (genuine vs.\nbacktranslated). Our experiments on Europarl-7 and IWSLT-10 show the\nfeasibility of multilingual transfer for DocNMT, particularly on\ndocument-specific metrics. We observe that more teacher languages and adequate\ndata balance both contribute to better transfer quality. Surprisingly, the\ntransfer is less sensitive to the data condition, where multilingual DocNMT\ndelivers decent performance with either backtranslated or genuine document\npairs."", 'summary_detail': {'type': 'text/plain', 'language': None, 'base': '', 'value': ""Document-level neural machine translation (DocNMT) achieves coherent\ntranslations by incorporating cross-sentence context. However, for most\nlanguage pairs there's a shortage of parallel documents, although parallel\nsentences are readily available. In this paper, we study whether and how\ncontextual modeling in DocNMT is transferable via multilingual modeling. We\nfocus on the scenario of zero-shot transfer from teacher languages with\ndocument level data to student languages with no documents but sentence level\ndata, and for the first time treat document-level translation as a transfer\nlearning problem. Using simple concatenation-based DocNMT, we explore the\neffect of 3 factors on the transfer: the number of teacher languages with\ndocument level data, the balance between document and sentence level data at\ntraining, and the data condition of parallel documents (genuine vs.\nbacktranslated). Our experiments on Europarl-7 and IWSLT-10 show the\nfeasibility of multilingual transfer for DocNMT, particularly on\ndocument-specific metrics. We observe that more teacher languages and adequate\ndata balance both contribute to better transfer quality. Surprisingly, the\ntransfer is less sensitive to the data condition, where multilingual DocNMT\ndelivers decent performance with either backtranslated or genuine document\npairs.""}, 'authors': [{'name': 'Biao Zhang'}, {'name': 'Ankur Bapna'}, {'name': 'Melvin Johnson'}, {'name': 'Ali Dabirmoghaddam'}, {'name': 'Naveen Arivazhagan'}, {'name': 'Orhan Firat'}], 'author_detail': {'name': 'Orhan Firat'}, 'author': 'Orhan Firat', 'arxiv_comment': 'ACL2022', 'links': [{'href': 'http://arxiv.org/abs/2109.10341v2', 'rel': 'alternate', 'type': 'text/html'}, {'title': 'pdf', 'href': 'http://arxiv.org/pdf/2109.10341v2', 'rel': 'related', 'type': 'application/pdf'}], 'arxiv_primary_category': {'term': 'cs.CL', 'scheme': 'http://arxiv.org/schemas/atom'}, 'tags': [{'term': 'cs.CL', 'scheme': 'http://arxiv.org/schemas/atom', 'label': None}, {'term': 'cs.LG', 'scheme': 'http://arxiv.org/schemas/atom', 'label': None}]}"
http://arxiv.org/abs/2203.07996v2,2022-03-26 04:11:10+00:00,2022-02-24 15:12:17+00:00,Leveraging Unimodal Self-Supervised Learning for Multimodal Audio-Visual Speech Recognition,"[arxiv.Result.Author('Xichen Pan'), arxiv.Result.Author('Peiyu Chen'), arxiv.Result.Author('Yichen Gong'), arxiv.Result.Author('Helong Zhou'), arxiv.Result.Author('Xinbing Wang'), arxiv.Result.Author('Zhouhan Lin')]","Training Transformer-based models demands a large amount of data, while
obtaining aligned and labelled data in multimodality is rather cost-demanding,
especially for audio-visual speech recognition (AVSR). Thus it makes a lot of
sense to make use of unlabelled unimodal data. On the other side, although the
effectiveness of large-scale self-supervised learning is well established in
both audio and visual modalities, how to integrate those pre-trained models
into a multimodal scenario remains underexplored. In this work, we successfully
leverage unimodal self-supervised learning to promote the multimodal AVSR. In
particular, audio and visual front-ends are trained on large-scale unimodal
datasets, then we integrate components of both front-ends into a larger
multimodal framework which learns to recognize parallel audio-visual data into
characters through a combination of CTC and seq2seq decoding. We show that both
components inherited from unimodal self-supervised learning cooperate well,
resulting in that the multimodal framework yields competitive results through
fine-tuning. Our model is experimentally validated on both word-level and
sentence-level tasks. Especially, even without an external language model, our
proposed model raises the state-of-the-art performances on the widely accepted
Lip Reading Sentences 2 (LRS2) dataset by a large margin, with a relative
improvement of 30%.",ACL2022 Main Conference,,,cs.SD,"['cs.SD', 'cs.AI', 'cs.CL', 'cs.CV', 'eess.AS']","[arxiv.Result.Link('http://arxiv.org/abs/2203.07996v2', title=None, rel='alternate', content_type=None), arxiv.Result.Link('http://arxiv.org/pdf/2203.07996v2', title='pdf', rel='related', content_type=None)]",http://arxiv.org/pdf/2203.07996v2,"{'id': 'http://arxiv.org/abs/2203.07996v2', 'guidislink': True, 'link': 'http://arxiv.org/abs/2203.07996v2', 'updated': '2022-03-26T04:11:10Z', 'updated_parsed': time.struct_time(tm_year=2022, tm_mon=3, tm_mday=26, tm_hour=4, tm_min=11, tm_sec=10, tm_wday=5, tm_yday=85, tm_isdst=0), 'published': '2022-02-24T15:12:17Z', 'published_parsed': time.struct_time(tm_year=2022, tm_mon=2, tm_mday=24, tm_hour=15, tm_min=12, tm_sec=17, tm_wday=3, tm_yday=55, tm_isdst=0), 'title': 'Leveraging Unimodal Self-Supervised Learning for Multimodal Audio-Visual\n  Speech Recognition', 'title_detail': {'type': 'text/plain', 'language': None, 'base': '', 'value': 'Leveraging Unimodal Self-Supervised Learning for Multimodal Audio-Visual\n  Speech Recognition'}, 'summary': 'Training Transformer-based models demands a large amount of data, while\nobtaining aligned and labelled data in multimodality is rather cost-demanding,\nespecially for audio-visual speech recognition (AVSR). Thus it makes a lot of\nsense to make use of unlabelled unimodal data. On the other side, although the\neffectiveness of large-scale self-supervised learning is well established in\nboth audio and visual modalities, how to integrate those pre-trained models\ninto a multimodal scenario remains underexplored. In this work, we successfully\nleverage unimodal self-supervised learning to promote the multimodal AVSR. In\nparticular, audio and visual front-ends are trained on large-scale unimodal\ndatasets, then we integrate components of both front-ends into a larger\nmultimodal framework which learns to recognize parallel audio-visual data into\ncharacters through a combination of CTC and seq2seq decoding. We show that both\ncomponents inherited from unimodal self-supervised learning cooperate well,\nresulting in that the multimodal framework yields competitive results through\nfine-tuning. Our model is experimentally validated on both word-level and\nsentence-level tasks. Especially, even without an external language model, our\nproposed model raises the state-of-the-art performances on the widely accepted\nLip Reading Sentences 2 (LRS2) dataset by a large margin, with a relative\nimprovement of 30%.', 'summary_detail': {'type': 'text/plain', 'language': None, 'base': '', 'value': 'Training Transformer-based models demands a large amount of data, while\nobtaining aligned and labelled data in multimodality is rather cost-demanding,\nespecially for audio-visual speech recognition (AVSR). Thus it makes a lot of\nsense to make use of unlabelled unimodal data. On the other side, although the\neffectiveness of large-scale self-supervised learning is well established in\nboth audio and visual modalities, how to integrate those pre-trained models\ninto a multimodal scenario remains underexplored. In this work, we successfully\nleverage unimodal self-supervised learning to promote the multimodal AVSR. In\nparticular, audio and visual front-ends are trained on large-scale unimodal\ndatasets, then we integrate components of both front-ends into a larger\nmultimodal framework which learns to recognize parallel audio-visual data into\ncharacters through a combination of CTC and seq2seq decoding. We show that both\ncomponents inherited from unimodal self-supervised learning cooperate well,\nresulting in that the multimodal framework yields competitive results through\nfine-tuning. Our model is experimentally validated on both word-level and\nsentence-level tasks. Especially, even without an external language model, our\nproposed model raises the state-of-the-art performances on the widely accepted\nLip Reading Sentences 2 (LRS2) dataset by a large margin, with a relative\nimprovement of 30%.'}, 'authors': [{'name': 'Xichen Pan'}, {'name': 'Peiyu Chen'}, {'name': 'Yichen Gong'}, {'name': 'Helong Zhou'}, {'name': 'Xinbing Wang'}, {'name': 'Zhouhan Lin'}], 'author_detail': {'name': 'Zhouhan Lin'}, 'author': 'Zhouhan Lin', 'arxiv_comment': 'ACL2022 Main Conference', 'links': [{'href': 'http://arxiv.org/abs/2203.07996v2', 'rel': 'alternate', 'type': 'text/html'}, {'title': 'pdf', 'href': 'http://arxiv.org/pdf/2203.07996v2', 'rel': 'related', 'type': 'application/pdf'}], 'arxiv_primary_category': {'term': 'cs.SD', 'scheme': 'http://arxiv.org/schemas/atom'}, 'tags': [{'term': 'cs.SD', 'scheme': 'http://arxiv.org/schemas/atom', 'label': None}, {'term': 'cs.AI', 'scheme': 'http://arxiv.org/schemas/atom', 'label': None}, {'term': 'cs.CL', 'scheme': 'http://arxiv.org/schemas/atom', 'label': None}, {'term': 'cs.CV', 'scheme': 'http://arxiv.org/schemas/atom', 'label': None}, {'term': 'eess.AS', 'scheme': 'http://arxiv.org/schemas/atom', 'label': None}]}"
http://arxiv.org/abs/2203.08556v1,2022-03-16 11:40:02+00:00,2022-03-16 11:40:02+00:00,LEVEN: A Large-Scale Chinese Legal Event Detection Dataset,"[arxiv.Result.Author('Feng Yao'), arxiv.Result.Author('Chaojun Xiao'), arxiv.Result.Author('Xiaozhi Wang'), arxiv.Result.Author('Zhiyuan Liu'), arxiv.Result.Author('Lei Hou'), arxiv.Result.Author('Cunchao Tu'), arxiv.Result.Author('Juanzi Li'), arxiv.Result.Author('Yun Liu'), arxiv.Result.Author('Weixing Shen'), arxiv.Result.Author('Maosong Sun')]","Recognizing facts is the most fundamental step in making judgments, hence
detecting events in the legal documents is important to legal case analysis
tasks. However, existing Legal Event Detection (LED) datasets only concern
incomprehensive event types and have limited annotated data, which restricts
the development of LED methods and their downstream applications. To alleviate
these issues, we present LEVEN a large-scale Chinese LEgal eVENt detection
dataset, with 8,116 legal documents and 150,977 human-annotated event mentions
in 108 event types. Not only charge-related events, LEVEN also covers general
events, which are critical for legal case understanding but neglected in
existing LED datasets. To our knowledge, LEVEN is the largest LED dataset and
has dozens of times the data scale of others, which shall significantly promote
the training and evaluation of LED methods. The results of extensive
experiments indicate that LED is challenging and needs further effort.
Moreover, we simply utilize legal events as side information to promote
downstream applications. The method achieves improvements of average 2.2 points
precision in low-resource judgment prediction, and 1.5 points mean average
precision in unsupervised case retrieval, which suggests the fundamentality of
LED. The source code and dataset can be obtained from
https://github.com/thunlp/LEVEN.",Accepted to ACL2022 Findings,,,cs.CL,"['cs.CL', 'cs.AI']","[arxiv.Result.Link('http://arxiv.org/abs/2203.08556v1', title=None, rel='alternate', content_type=None), arxiv.Result.Link('http://arxiv.org/pdf/2203.08556v1', title='pdf', rel='related', content_type=None)]",http://arxiv.org/pdf/2203.08556v1,"{'id': 'http://arxiv.org/abs/2203.08556v1', 'guidislink': True, 'link': 'http://arxiv.org/abs/2203.08556v1', 'updated': '2022-03-16T11:40:02Z', 'updated_parsed': time.struct_time(tm_year=2022, tm_mon=3, tm_mday=16, tm_hour=11, tm_min=40, tm_sec=2, tm_wday=2, tm_yday=75, tm_isdst=0), 'published': '2022-03-16T11:40:02Z', 'published_parsed': time.struct_time(tm_year=2022, tm_mon=3, tm_mday=16, tm_hour=11, tm_min=40, tm_sec=2, tm_wday=2, tm_yday=75, tm_isdst=0), 'title': 'LEVEN: A Large-Scale Chinese Legal Event Detection Dataset', 'title_detail': {'type': 'text/plain', 'language': None, 'base': '', 'value': 'LEVEN: A Large-Scale Chinese Legal Event Detection Dataset'}, 'summary': 'Recognizing facts is the most fundamental step in making judgments, hence\ndetecting events in the legal documents is important to legal case analysis\ntasks. However, existing Legal Event Detection (LED) datasets only concern\nincomprehensive event types and have limited annotated data, which restricts\nthe development of LED methods and their downstream applications. To alleviate\nthese issues, we present LEVEN a large-scale Chinese LEgal eVENt detection\ndataset, with 8,116 legal documents and 150,977 human-annotated event mentions\nin 108 event types. Not only charge-related events, LEVEN also covers general\nevents, which are critical for legal case understanding but neglected in\nexisting LED datasets. To our knowledge, LEVEN is the largest LED dataset and\nhas dozens of times the data scale of others, which shall significantly promote\nthe training and evaluation of LED methods. The results of extensive\nexperiments indicate that LED is challenging and needs further effort.\nMoreover, we simply utilize legal events as side information to promote\ndownstream applications. The method achieves improvements of average 2.2 points\nprecision in low-resource judgment prediction, and 1.5 points mean average\nprecision in unsupervised case retrieval, which suggests the fundamentality of\nLED. The source code and dataset can be obtained from\nhttps://github.com/thunlp/LEVEN.', 'summary_detail': {'type': 'text/plain', 'language': None, 'base': '', 'value': 'Recognizing facts is the most fundamental step in making judgments, hence\ndetecting events in the legal documents is important to legal case analysis\ntasks. However, existing Legal Event Detection (LED) datasets only concern\nincomprehensive event types and have limited annotated data, which restricts\nthe development of LED methods and their downstream applications. To alleviate\nthese issues, we present LEVEN a large-scale Chinese LEgal eVENt detection\ndataset, with 8,116 legal documents and 150,977 human-annotated event mentions\nin 108 event types. Not only charge-related events, LEVEN also covers general\nevents, which are critical for legal case understanding but neglected in\nexisting LED datasets. To our knowledge, LEVEN is the largest LED dataset and\nhas dozens of times the data scale of others, which shall significantly promote\nthe training and evaluation of LED methods. The results of extensive\nexperiments indicate that LED is challenging and needs further effort.\nMoreover, we simply utilize legal events as side information to promote\ndownstream applications. The method achieves improvements of average 2.2 points\nprecision in low-resource judgment prediction, and 1.5 points mean average\nprecision in unsupervised case retrieval, which suggests the fundamentality of\nLED. The source code and dataset can be obtained from\nhttps://github.com/thunlp/LEVEN.'}, 'authors': [{'name': 'Feng Yao'}, {'name': 'Chaojun Xiao'}, {'name': 'Xiaozhi Wang'}, {'name': 'Zhiyuan Liu'}, {'name': 'Lei Hou'}, {'name': 'Cunchao Tu'}, {'name': 'Juanzi Li'}, {'name': 'Yun Liu'}, {'name': 'Weixing Shen'}, {'name': 'Maosong Sun'}], 'author_detail': {'name': 'Maosong Sun'}, 'author': 'Maosong Sun', 'arxiv_comment': 'Accepted to ACL2022 Findings', 'links': [{'href': 'http://arxiv.org/abs/2203.08556v1', 'rel': 'alternate', 'type': 'text/html'}, {'title': 'pdf', 'href': 'http://arxiv.org/pdf/2203.08556v1', 'rel': 'related', 'type': 'application/pdf'}], 'arxiv_primary_category': {'term': 'cs.CL', 'scheme': 'http://arxiv.org/schemas/atom'}, 'tags': [{'term': 'cs.CL', 'scheme': 'http://arxiv.org/schemas/atom', 'label': None}, {'term': 'cs.AI', 'scheme': 'http://arxiv.org/schemas/atom', 'label': None}]}"
