entry_id,updated,published,title,authors,summary,comment,journal_ref,doi,primary_category,categories,links,pdf_url,_raw
http://arxiv.org/abs/2204.01227v1,2022-04-04 04:09:15+00:00,2022-04-04 04:09:15+00:00,Diverse Text Generation via Variational Encoder-Decoder Models with Gaussian Process Priors,"[arxiv.Result.Author('Wanyu Du'), arxiv.Result.Author('Jianqiao Zhao'), arxiv.Result.Author('Liwei Wang'), arxiv.Result.Author('Yangfeng Ji')]","Generating high quality texts with high diversity is important for many NLG
applications, but current methods mostly focus on building deterministic models
to generate higher quality texts and do not provide many options for promoting
diversity. In this work, we present a novel latent structured variable model to
generate high quality texts by enriching contextual representation learning of
encoder-decoder models. Specifically, we introduce a stochastic function to map
deterministic encoder hidden states into random context variables. The proposed
stochastic function is sampled from a Gaussian process prior to (1) provide
infinite number of joint Gaussian distributions of random context variables
(diversity-promoting) and (2) explicitly model dependency between context
variables (accurate-encoding). To address the learning challenge of Gaussian
processes, we propose an efficient variational inference approach to
approximate the posterior distribution of random context variables. We evaluate
our method in two typical text generation tasks: paraphrase generation and text
style transfer. Experimental results on benchmark datasets demonstrate that our
method improves the generation quality and diversity compared with other
baselines.",Accepted by 6th Workshop on Structured Prediction for NLP at ACL2022,,,cs.CL,['cs.CL'],"[arxiv.Result.Link('http://arxiv.org/abs/2204.01227v1', title=None, rel='alternate', content_type=None), arxiv.Result.Link('http://arxiv.org/pdf/2204.01227v1', title='pdf', rel='related', content_type=None)]",http://arxiv.org/pdf/2204.01227v1,"{'id': 'http://arxiv.org/abs/2204.01227v1', 'guidislink': True, 'link': 'http://arxiv.org/abs/2204.01227v1', 'updated': '2022-04-04T04:09:15Z', 'updated_parsed': time.struct_time(tm_year=2022, tm_mon=4, tm_mday=4, tm_hour=4, tm_min=9, tm_sec=15, tm_wday=0, tm_yday=94, tm_isdst=0), 'published': '2022-04-04T04:09:15Z', 'published_parsed': time.struct_time(tm_year=2022, tm_mon=4, tm_mday=4, tm_hour=4, tm_min=9, tm_sec=15, tm_wday=0, tm_yday=94, tm_isdst=0), 'title': 'Diverse Text Generation via Variational Encoder-Decoder Models with\n  Gaussian Process Priors', 'title_detail': {'type': 'text/plain', 'language': None, 'base': '', 'value': 'Diverse Text Generation via Variational Encoder-Decoder Models with\n  Gaussian Process Priors'}, 'summary': 'Generating high quality texts with high diversity is important for many NLG\napplications, but current methods mostly focus on building deterministic models\nto generate higher quality texts and do not provide many options for promoting\ndiversity. In this work, we present a novel latent structured variable model to\ngenerate high quality texts by enriching contextual representation learning of\nencoder-decoder models. Specifically, we introduce a stochastic function to map\ndeterministic encoder hidden states into random context variables. The proposed\nstochastic function is sampled from a Gaussian process prior to (1) provide\ninfinite number of joint Gaussian distributions of random context variables\n(diversity-promoting) and (2) explicitly model dependency between context\nvariables (accurate-encoding). To address the learning challenge of Gaussian\nprocesses, we propose an efficient variational inference approach to\napproximate the posterior distribution of random context variables. We evaluate\nour method in two typical text generation tasks: paraphrase generation and text\nstyle transfer. Experimental results on benchmark datasets demonstrate that our\nmethod improves the generation quality and diversity compared with other\nbaselines.', 'summary_detail': {'type': 'text/plain', 'language': None, 'base': '', 'value': 'Generating high quality texts with high diversity is important for many NLG\napplications, but current methods mostly focus on building deterministic models\nto generate higher quality texts and do not provide many options for promoting\ndiversity. In this work, we present a novel latent structured variable model to\ngenerate high quality texts by enriching contextual representation learning of\nencoder-decoder models. Specifically, we introduce a stochastic function to map\ndeterministic encoder hidden states into random context variables. The proposed\nstochastic function is sampled from a Gaussian process prior to (1) provide\ninfinite number of joint Gaussian distributions of random context variables\n(diversity-promoting) and (2) explicitly model dependency between context\nvariables (accurate-encoding). To address the learning challenge of Gaussian\nprocesses, we propose an efficient variational inference approach to\napproximate the posterior distribution of random context variables. We evaluate\nour method in two typical text generation tasks: paraphrase generation and text\nstyle transfer. Experimental results on benchmark datasets demonstrate that our\nmethod improves the generation quality and diversity compared with other\nbaselines.'}, 'authors': [{'name': 'Wanyu Du'}, {'name': 'Jianqiao Zhao'}, {'name': 'Liwei Wang'}, {'name': 'Yangfeng Ji'}], 'author_detail': {'name': 'Yangfeng Ji'}, 'author': 'Yangfeng Ji', 'arxiv_comment': 'Accepted by 6th Workshop on Structured Prediction for NLP at ACL2022', 'links': [{'href': 'http://arxiv.org/abs/2204.01227v1', 'rel': 'alternate', 'type': 'text/html'}, {'title': 'pdf', 'href': 'http://arxiv.org/pdf/2204.01227v1', 'rel': 'related', 'type': 'application/pdf'}], 'arxiv_primary_category': {'term': 'cs.CL', 'scheme': 'http://arxiv.org/schemas/atom'}, 'tags': [{'term': 'cs.CL', 'scheme': 'http://arxiv.org/schemas/atom', 'label': None}]}"
http://arxiv.org/abs/2204.02261v1,2022-04-05 14:52:18+00:00,2022-04-05 14:52:18+00:00,Improving Generalizability in Implicitly Abusive Language Detection with Concept Activation Vectors,"[arxiv.Result.Author('Isar Nejadgholi'), arxiv.Result.Author('Kathleen C. Fraser'), arxiv.Result.Author('Svetlana Kiritchenko')]","Robustness of machine learning models on ever-changing real-world data is
critical, especially for applications affecting human well-being such as
content moderation. New kinds of abusive language continually emerge in online
discussions in response to current events (e.g., COVID-19), and the deployed
abuse detection systems should be updated regularly to remain accurate. In this
paper, we show that general abusive language classifiers tend to be fairly
reliable in detecting out-of-domain explicitly abusive utterances but fail to
detect new types of more subtle, implicit abuse. Next, we propose an
interpretability technique, based on the Testing Concept Activation Vector
(TCAV) method from computer vision, to quantify the sensitivity of a trained
model to the human-defined concepts of explicit and implicit abusive language,
and use that to explain the generalizability of the model on new data, in this
case, COVID-related anti-Asian hate speech. Extending this technique, we
introduce a novel metric, Degree of Explicitness, for a single instance and
show that the new metric is beneficial in suggesting out-of-domain unlabeled
examples to effectively enrich the training data with informative, implicitly
abusive texts.",accepted to be published at ACL2022,,,cs.CL,"['cs.CL', 'cs.LG']","[arxiv.Result.Link('http://arxiv.org/abs/2204.02261v1', title=None, rel='alternate', content_type=None), arxiv.Result.Link('http://arxiv.org/pdf/2204.02261v1', title='pdf', rel='related', content_type=None)]",http://arxiv.org/pdf/2204.02261v1,"{'id': 'http://arxiv.org/abs/2204.02261v1', 'guidislink': True, 'link': 'http://arxiv.org/abs/2204.02261v1', 'updated': '2022-04-05T14:52:18Z', 'updated_parsed': time.struct_time(tm_year=2022, tm_mon=4, tm_mday=5, tm_hour=14, tm_min=52, tm_sec=18, tm_wday=1, tm_yday=95, tm_isdst=0), 'published': '2022-04-05T14:52:18Z', 'published_parsed': time.struct_time(tm_year=2022, tm_mon=4, tm_mday=5, tm_hour=14, tm_min=52, tm_sec=18, tm_wday=1, tm_yday=95, tm_isdst=0), 'title': 'Improving Generalizability in Implicitly Abusive Language Detection with\n  Concept Activation Vectors', 'title_detail': {'type': 'text/plain', 'language': None, 'base': '', 'value': 'Improving Generalizability in Implicitly Abusive Language Detection with\n  Concept Activation Vectors'}, 'summary': 'Robustness of machine learning models on ever-changing real-world data is\ncritical, especially for applications affecting human well-being such as\ncontent moderation. New kinds of abusive language continually emerge in online\ndiscussions in response to current events (e.g., COVID-19), and the deployed\nabuse detection systems should be updated regularly to remain accurate. In this\npaper, we show that general abusive language classifiers tend to be fairly\nreliable in detecting out-of-domain explicitly abusive utterances but fail to\ndetect new types of more subtle, implicit abuse. Next, we propose an\ninterpretability technique, based on the Testing Concept Activation Vector\n(TCAV) method from computer vision, to quantify the sensitivity of a trained\nmodel to the human-defined concepts of explicit and implicit abusive language,\nand use that to explain the generalizability of the model on new data, in this\ncase, COVID-related anti-Asian hate speech. Extending this technique, we\nintroduce a novel metric, Degree of Explicitness, for a single instance and\nshow that the new metric is beneficial in suggesting out-of-domain unlabeled\nexamples to effectively enrich the training data with informative, implicitly\nabusive texts.', 'summary_detail': {'type': 'text/plain', 'language': None, 'base': '', 'value': 'Robustness of machine learning models on ever-changing real-world data is\ncritical, especially for applications affecting human well-being such as\ncontent moderation. New kinds of abusive language continually emerge in online\ndiscussions in response to current events (e.g., COVID-19), and the deployed\nabuse detection systems should be updated regularly to remain accurate. In this\npaper, we show that general abusive language classifiers tend to be fairly\nreliable in detecting out-of-domain explicitly abusive utterances but fail to\ndetect new types of more subtle, implicit abuse. Next, we propose an\ninterpretability technique, based on the Testing Concept Activation Vector\n(TCAV) method from computer vision, to quantify the sensitivity of a trained\nmodel to the human-defined concepts of explicit and implicit abusive language,\nand use that to explain the generalizability of the model on new data, in this\ncase, COVID-related anti-Asian hate speech. Extending this technique, we\nintroduce a novel metric, Degree of Explicitness, for a single instance and\nshow that the new metric is beneficial in suggesting out-of-domain unlabeled\nexamples to effectively enrich the training data with informative, implicitly\nabusive texts.'}, 'authors': [{'name': 'Isar Nejadgholi'}, {'name': 'Kathleen C. Fraser'}, {'name': 'Svetlana Kiritchenko'}], 'author_detail': {'name': 'Svetlana Kiritchenko'}, 'author': 'Svetlana Kiritchenko', 'arxiv_comment': 'accepted to be published at ACL2022', 'links': [{'href': 'http://arxiv.org/abs/2204.02261v1', 'rel': 'alternate', 'type': 'text/html'}, {'title': 'pdf', 'href': 'http://arxiv.org/pdf/2204.02261v1', 'rel': 'related', 'type': 'application/pdf'}], 'arxiv_primary_category': {'term': 'cs.CL', 'scheme': 'http://arxiv.org/schemas/atom'}, 'tags': [{'term': 'cs.CL', 'scheme': 'http://arxiv.org/schemas/atom', 'label': None}, {'term': 'cs.LG', 'scheme': 'http://arxiv.org/schemas/atom', 'label': None}]}"
http://arxiv.org/abs/2204.07299v1,2022-04-15 02:30:45+00:00,2022-04-15 02:30:45+00:00,Where to Go for the Holidays: Towards Mixed-Type Dialogs for Clarification of User Goals,"[arxiv.Result.Author('Zeming Liu'), arxiv.Result.Author('Jun Xu'), arxiv.Result.Author('Zeyang Lei'), arxiv.Result.Author('Haifeng Wang'), arxiv.Result.Author('Zheng-Yu Niu'), arxiv.Result.Author('Hua Wu')]","Most dialog systems posit that users have figured out clear and specific
goals before starting an interaction. For example, users have determined the
departure, the destination, and the travel time for booking a flight. However,
in many scenarios, limited by experience and knowledge, users may know what
they need, but still struggle to figure out clear and specific goals by
determining all the necessary slots.
  In this paper, we identify this challenge and make a step forward by
collecting a new human-to-human mixed-type dialog corpus. It contains 5k dialog
sessions and 168k utterances for 4 dialog types and 5 domains. Within each
session, an agent first provides user-goal-related knowledge to help figure out
clear and specific goals, and then help achieve them.
  Furthermore, we propose a mixed-type dialog model with a novel Prompt-based
continual learning mechanism. Specifically, the mechanism enables the model to
continually strengthen its ability on any specific type by utilizing existing
dialog corpora effectively.","ACL2022 Main conference. First two authors contributed equally to
  this work",,,cs.CL,['cs.CL'],"[arxiv.Result.Link('http://arxiv.org/abs/2204.07299v1', title=None, rel='alternate', content_type=None), arxiv.Result.Link('http://arxiv.org/pdf/2204.07299v1', title='pdf', rel='related', content_type=None)]",http://arxiv.org/pdf/2204.07299v1,"{'id': 'http://arxiv.org/abs/2204.07299v1', 'guidislink': True, 'link': 'http://arxiv.org/abs/2204.07299v1', 'updated': '2022-04-15T02:30:45Z', 'updated_parsed': time.struct_time(tm_year=2022, tm_mon=4, tm_mday=15, tm_hour=2, tm_min=30, tm_sec=45, tm_wday=4, tm_yday=105, tm_isdst=0), 'published': '2022-04-15T02:30:45Z', 'published_parsed': time.struct_time(tm_year=2022, tm_mon=4, tm_mday=15, tm_hour=2, tm_min=30, tm_sec=45, tm_wday=4, tm_yday=105, tm_isdst=0), 'title': 'Where to Go for the Holidays: Towards Mixed-Type Dialogs for\n  Clarification of User Goals', 'title_detail': {'type': 'text/plain', 'language': None, 'base': '', 'value': 'Where to Go for the Holidays: Towards Mixed-Type Dialogs for\n  Clarification of User Goals'}, 'summary': 'Most dialog systems posit that users have figured out clear and specific\ngoals before starting an interaction. For example, users have determined the\ndeparture, the destination, and the travel time for booking a flight. However,\nin many scenarios, limited by experience and knowledge, users may know what\nthey need, but still struggle to figure out clear and specific goals by\ndetermining all the necessary slots.\n  In this paper, we identify this challenge and make a step forward by\ncollecting a new human-to-human mixed-type dialog corpus. It contains 5k dialog\nsessions and 168k utterances for 4 dialog types and 5 domains. Within each\nsession, an agent first provides user-goal-related knowledge to help figure out\nclear and specific goals, and then help achieve them.\n  Furthermore, we propose a mixed-type dialog model with a novel Prompt-based\ncontinual learning mechanism. Specifically, the mechanism enables the model to\ncontinually strengthen its ability on any specific type by utilizing existing\ndialog corpora effectively.', 'summary_detail': {'type': 'text/plain', 'language': None, 'base': '', 'value': 'Most dialog systems posit that users have figured out clear and specific\ngoals before starting an interaction. For example, users have determined the\ndeparture, the destination, and the travel time for booking a flight. However,\nin many scenarios, limited by experience and knowledge, users may know what\nthey need, but still struggle to figure out clear and specific goals by\ndetermining all the necessary slots.\n  In this paper, we identify this challenge and make a step forward by\ncollecting a new human-to-human mixed-type dialog corpus. It contains 5k dialog\nsessions and 168k utterances for 4 dialog types and 5 domains. Within each\nsession, an agent first provides user-goal-related knowledge to help figure out\nclear and specific goals, and then help achieve them.\n  Furthermore, we propose a mixed-type dialog model with a novel Prompt-based\ncontinual learning mechanism. Specifically, the mechanism enables the model to\ncontinually strengthen its ability on any specific type by utilizing existing\ndialog corpora effectively.'}, 'authors': [{'name': 'Zeming Liu'}, {'name': 'Jun Xu'}, {'name': 'Zeyang Lei'}, {'name': 'Haifeng Wang'}, {'name': 'Zheng-Yu Niu'}, {'name': 'Hua Wu'}], 'author_detail': {'name': 'Hua Wu'}, 'author': 'Hua Wu', 'arxiv_comment': 'ACL2022 Main conference. First two authors contributed equally to\n  this work', 'links': [{'href': 'http://arxiv.org/abs/2204.07299v1', 'rel': 'alternate', 'type': 'text/html'}, {'title': 'pdf', 'href': 'http://arxiv.org/pdf/2204.07299v1', 'rel': 'related', 'type': 'application/pdf'}], 'arxiv_primary_category': {'term': 'cs.CL', 'scheme': 'http://arxiv.org/schemas/atom'}, 'tags': [{'term': 'cs.CL', 'scheme': 'http://arxiv.org/schemas/atom', 'label': None}]}"
http://arxiv.org/abs/2204.08325v1,2022-04-18 13:56:58+00:00,2022-04-18 13:56:58+00:00,GL-CLeF: A Global-Local Contrastive Learning Framework for Cross-lingual Spoken Language Understanding,"[arxiv.Result.Author('Libo Qin'), arxiv.Result.Author('Qiguang Chen'), arxiv.Result.Author('Tianbao Xie'), arxiv.Result.Author('Qixin Li'), arxiv.Result.Author('Jian-Guang Lou'), arxiv.Result.Author('Wanxiang Che'), arxiv.Result.Author('Min-Yen Kan')]","Due to high data demands of current methods, attention to zero-shot
cross-lingual spoken language understanding (SLU) has grown, as such approaches
greatly reduce human annotation effort. However, existing models solely rely on
shared parameters, which can only perform implicit alignment across languages.
We present Global--Local Contrastive Learning Framework (GL-CLeF) to address
this shortcoming. Specifically, we employ contrastive learning, leveraging
bilingual dictionaries to construct multilingual views of the same utterance,
then encourage their representations to be more similar than negative example
pairs, which achieves to explicitly aligned representations of similar
sentences across languages. In addition, a key step in GL-CLeF is a proposed
Local and Global component, which achieves a fine-grained cross-lingual
transfer (i.e., sentence-level Local intent transfer, token-level Local slot
transfer, and semantic-level Global transfer across intent and slot).
Experiments on MultiATIS++ show that GL-CLeF achieves the best performance and
successfully pulls representations of similar sentences across languages
closer.",Accepted at ACL2022 Main Conference,,,cs.CL,['cs.CL'],"[arxiv.Result.Link('http://arxiv.org/abs/2204.08325v1', title=None, rel='alternate', content_type=None), arxiv.Result.Link('http://arxiv.org/pdf/2204.08325v1', title='pdf', rel='related', content_type=None)]",http://arxiv.org/pdf/2204.08325v1,"{'id': 'http://arxiv.org/abs/2204.08325v1', 'guidislink': True, 'link': 'http://arxiv.org/abs/2204.08325v1', 'updated': '2022-04-18T13:56:58Z', 'updated_parsed': time.struct_time(tm_year=2022, tm_mon=4, tm_mday=18, tm_hour=13, tm_min=56, tm_sec=58, tm_wday=0, tm_yday=108, tm_isdst=0), 'published': '2022-04-18T13:56:58Z', 'published_parsed': time.struct_time(tm_year=2022, tm_mon=4, tm_mday=18, tm_hour=13, tm_min=56, tm_sec=58, tm_wday=0, tm_yday=108, tm_isdst=0), 'title': 'GL-CLeF: A Global-Local Contrastive Learning Framework for Cross-lingual\n  Spoken Language Understanding', 'title_detail': {'type': 'text/plain', 'language': None, 'base': '', 'value': 'GL-CLeF: A Global-Local Contrastive Learning Framework for Cross-lingual\n  Spoken Language Understanding'}, 'summary': 'Due to high data demands of current methods, attention to zero-shot\ncross-lingual spoken language understanding (SLU) has grown, as such approaches\ngreatly reduce human annotation effort. However, existing models solely rely on\nshared parameters, which can only perform implicit alignment across languages.\nWe present Global--Local Contrastive Learning Framework (GL-CLeF) to address\nthis shortcoming. Specifically, we employ contrastive learning, leveraging\nbilingual dictionaries to construct multilingual views of the same utterance,\nthen encourage their representations to be more similar than negative example\npairs, which achieves to explicitly aligned representations of similar\nsentences across languages. In addition, a key step in GL-CLeF is a proposed\nLocal and Global component, which achieves a fine-grained cross-lingual\ntransfer (i.e., sentence-level Local intent transfer, token-level Local slot\ntransfer, and semantic-level Global transfer across intent and slot).\nExperiments on MultiATIS++ show that GL-CLeF achieves the best performance and\nsuccessfully pulls representations of similar sentences across languages\ncloser.', 'summary_detail': {'type': 'text/plain', 'language': None, 'base': '', 'value': 'Due to high data demands of current methods, attention to zero-shot\ncross-lingual spoken language understanding (SLU) has grown, as such approaches\ngreatly reduce human annotation effort. However, existing models solely rely on\nshared parameters, which can only perform implicit alignment across languages.\nWe present Global--Local Contrastive Learning Framework (GL-CLeF) to address\nthis shortcoming. Specifically, we employ contrastive learning, leveraging\nbilingual dictionaries to construct multilingual views of the same utterance,\nthen encourage their representations to be more similar than negative example\npairs, which achieves to explicitly aligned representations of similar\nsentences across languages. In addition, a key step in GL-CLeF is a proposed\nLocal and Global component, which achieves a fine-grained cross-lingual\ntransfer (i.e., sentence-level Local intent transfer, token-level Local slot\ntransfer, and semantic-level Global transfer across intent and slot).\nExperiments on MultiATIS++ show that GL-CLeF achieves the best performance and\nsuccessfully pulls representations of similar sentences across languages\ncloser.'}, 'authors': [{'name': 'Libo Qin'}, {'name': 'Qiguang Chen'}, {'name': 'Tianbao Xie'}, {'name': 'Qixin Li'}, {'name': 'Jian-Guang Lou'}, {'name': 'Wanxiang Che'}, {'name': 'Min-Yen Kan'}], 'author_detail': {'name': 'Min-Yen Kan'}, 'author': 'Min-Yen Kan', 'arxiv_comment': 'Accepted at ACL2022 Main Conference', 'links': [{'href': 'http://arxiv.org/abs/2204.08325v1', 'rel': 'alternate', 'type': 'text/html'}, {'title': 'pdf', 'href': 'http://arxiv.org/pdf/2204.08325v1', 'rel': 'related', 'type': 'application/pdf'}], 'arxiv_primary_category': {'term': 'cs.CL', 'scheme': 'http://arxiv.org/schemas/atom'}, 'tags': [{'term': 'cs.CL', 'scheme': 'http://arxiv.org/schemas/atom', 'label': None}]}"
